{"claimed_trust":"untrusted","content_hash":"sha256:b7ffcb56ac510374bb6263eb930a34bc5fe3b82dd11fcc78aaa1799b23b0f72b","idempotency_key":"run_066a56a89235a19ed7f3a85cc63ca6db29863cdad977d95dbee90553139ccc9d","payload":{"calibration_admission_digest":null,"calibration_bank":null,"capability_validation":{"authentication_probe":{"failure":null,"mode":"chatgpt_subscription","status":"available"},"cli_probe":{"failure":null,"status":"available","version":"codex fixture"},"manifest_issues":[],"models":[{"model":{"family":"sol","reasoning_effort":"low"},"probe":{"artifacts":[{"bytes":28,"content_hash":"sha256:0948f6822d531c10e643a2e24332e912eec6261a4daf3267818cbc472c41b394","kind":"stdout.jsonl","uri":"aiq-artifact://sha256/0948f6822d531c10e643a2e24332e912eec6261a4daf3267818cbc472c41b394/stdout.jsonl"},{"bytes":36,"content_hash":"sha256:83741534dc3125175944ec8e34d515ff35682d83fba0a4cf40d32ccaaaacacf3","kind":"capability-marker.txt","uri":"aiq-artifact://sha256/83741534dc3125175944ec8e34d515ff35682d83fba0a4cf40d32ccaaaacacf3/capability-marker.txt"}],"codex_version":"codex fixture","evidence_digest":"sha256:fb730f3249d2dd035ba6d1ddbf7ce9e47cf3e63f45149e1c126e9afefff55578","failure":null,"observed_at":"unix-ms:1","result_digest":"sha256:0948f6822d531c10e643a2e24332e912eec6261a4daf3267818cbc472c41b394","result_preview":"AIQ_PREFLIGHT_OK","status":"available"},"reason":"active probe succeeded","status":"available"},{"model":{"family":"sol","reasoning_effort":"medium"},"probe":{"artifacts":[{"bytes":36,"content_hash":"sha256:83741534dc3125175944ec8e34d515ff35682d83fba0a4cf40d32ccaaaacacf3","kind":"capability-marker.txt","uri":"aiq-artifact://sha256/83741534dc3125175944ec8e34d515ff35682d83fba0a4cf40d32ccaaaacacf3/capability-marker.txt"}],"codex_version":"codex fixture","evidence_digest":"sha256:aba004de9777a379a99ef3bb555652da0851ab51ac09e2835ae4d990eba2442e","failure":null,"observed_at":"unix-ms:1","result_digest":"sha256:d589d72f939227c9ab28e3cbb50546a732fbcfe00269b193557c76ea05fdd18e","result_preview":"AIQ_PREFLIGHT_OK","status":"available"},"reason":"active probe succeeded","status":"available"},{"model":{"family":"sol","reasoning_effort":"high"},"probe":{"artifacts":[{"bytes":36,"content_hash":"sha256:83741534dc3125175944ec8e34d515ff35682d83fba0a4cf40d32ccaaaacacf3","kind":"capability-marker.txt","uri":"aiq-artifact://sha256/83741534dc3125175944ec8e34d515ff35682d83fba0a4cf40d32ccaaaacacf3/capability-marker.txt"}],"codex_version":"codex fixture","evidence_digest":"sha256:4fcb510a943f8af98b35ddb4f3c8be48de65a343ad0b7100eab1bca4dde22836","failure":null,"observed_at":"unix-ms:1","result_digest":"sha256:d589d72f939227c9ab28e3cbb50546a732fbcfe00269b193557c76ea05fdd18e","result_preview":"AIQ_PREFLIGHT_OK","status":"available"},"reason":"active probe succeeded","status":"available"},{"model":{"family":"sol","reasoning_effort":"xhigh"},"probe":{"artifacts":[{"bytes":36,"content_hash":"sha256:83741534dc3125175944ec8e34d515ff35682d83fba0a4cf40d32ccaaaacacf3","kind":"capability-marker.txt","uri":"aiq-artifact://sha256/83741534dc3125175944ec8e34d515ff35682d83fba0a4cf40d32ccaaaacacf3/capability-marker.txt"}],"codex_version":"codex fixture","evidence_digest":"sha256:cb4fbd6422fe0b34c1f0e4d708b4955a16a6645808f75863392c6522c743525d","failure":null,"observed_at":"unix-ms:1","result_digest":"sha256:d589d72f939227c9ab28e3cbb50546a732fbcfe00269b193557c76ea05fdd18e","result_preview":"AIQ_PREFLIGHT_OK","status":"available"},"reason":"active probe succeeded","status":"available"},{"model":{"family":"sol","reasoning_effort":"max"},"probe":{"artifacts":[{"bytes":36,"content_hash":"sha256:83741534dc3125175944ec8e34d515ff35682d83fba0a4cf40d32ccaaaacacf3","kind":"capability-marker.txt","uri":"aiq-artifact://sha256/83741534dc3125175944ec8e34d515ff35682d83fba0a4cf40d32ccaaaacacf3/capability-marker.txt"}],"codex_version":"codex fixture","evidence_digest":"sha256:41b4d51254b13a9b1de744c90802dad4c0ff058eeaf3f3c48268241a1b679f71","failure":null,"observed_at":"unix-ms:1","result_digest":"sha256:d589d72f939227c9ab28e3cbb50546a732fbcfe00269b193557c76ea05fdd18e","result_preview":"AIQ_PREFLIGHT_OK","status":"available"},"reason":"active probe succeeded","status":"available"},{"model":{"family":"sol","reasoning_effort":"ultra"},"probe":{"artifacts":[{"bytes":36,"content_hash":"sha256:83741534dc3125175944ec8e34d515ff35682d83fba0a4cf40d32ccaaaacacf3","kind":"capability-marker.txt","uri":"aiq-artifact://sha256/83741534dc3125175944ec8e34d515ff35682d83fba0a4cf40d32ccaaaacacf3/capability-marker.txt"}],"codex_version":"codex fixture","evidence_digest":"sha256:babd431c9e51003758e3482979cc8aa87736de0869c029074a28cebc26e63838","failure":null,"observed_at":"unix-ms:1","result_digest":"sha256:d589d72f939227c9ab28e3cbb50546a732fbcfe00269b193557c76ea05fdd18e","result_preview":"AIQ_PREFLIGHT_OK","status":"available"},"reason":"active probe succeeded","status":"available"},{"model":{"family":"terra","reasoning_effort":"low"},"probe":{"artifacts":[{"bytes":36,"content_hash":"sha256:83741534dc3125175944ec8e34d515ff35682d83fba0a4cf40d32ccaaaacacf3","kind":"capability-marker.txt","uri":"aiq-artifact://sha256/83741534dc3125175944ec8e34d515ff35682d83fba0a4cf40d32ccaaaacacf3/capability-marker.txt"}],"codex_version":"codex fixture","evidence_digest":"sha256:6b61702eac1c274ed8463a7898c3a78fd0b5250afdfff947917fb914e0e91f15","failure":null,"observed_at":"unix-ms:1","result_digest":"sha256:d589d72f939227c9ab28e3cbb50546a732fbcfe00269b193557c76ea05fdd18e","result_preview":"AIQ_PREFLIGHT_OK","status":"available"},"reason":"active probe succeeded","status":"available"},{"model":{"family":"terra","reasoning_effort":"medium"},"probe":{"artifacts":[{"bytes":36,"content_hash":"sha256:83741534dc3125175944ec8e34d515ff35682d83fba0a4cf40d32ccaaaacacf3","kind":"capability-marker.txt","uri":"aiq-artifact://sha256/83741534dc3125175944ec8e34d515ff35682d83fba0a4cf40d32ccaaaacacf3/capability-marker.txt"}],"codex_version":"codex fixture","evidence_digest":"sha256:f743f9299e76c0295ee39da16a8aff61c31e74de1ba5a16d9c076bc697e7d7c1","failure":null,"observed_at":"unix-ms:1","result_digest":"sha256:d589d72f939227c9ab28e3cbb50546a732fbcfe00269b193557c76ea05fdd18e","result_preview":"AIQ_PREFLIGHT_OK","status":"available"},"reason":"active probe succeeded","status":"available"},{"model":{"family":"terra","reasoning_effort":"high"},"probe":{"artifacts":[{"bytes":36,"content_hash":"sha256:83741534dc3125175944ec8e34d515ff35682d83fba0a4cf40d32ccaaaacacf3","kind":"capability-marker.txt","uri":"aiq-artifact://sha256/83741534dc3125175944ec8e34d515ff35682d83fba0a4cf40d32ccaaaacacf3/capability-marker.txt"}],"codex_version":"codex fixture","evidence_digest":"sha256:b7ebc3aaeb9dc6dd6610bbd0b097d284536d17934a669c4ca7f490cc888b5ef7","failure":null,"observed_at":"unix-ms:1","result_digest":"sha256:d589d72f939227c9ab28e3cbb50546a732fbcfe00269b193557c76ea05fdd18e","result_preview":"AIQ_PREFLIGHT_OK","status":"available"},"reason":"active probe succeeded","status":"available"},{"model":{"family":"terra","reasoning_effort":"xhigh"},"probe":{"artifacts":[{"bytes":36,"content_hash":"sha256:83741534dc3125175944ec8e34d515ff35682d83fba0a4cf40d32ccaaaacacf3","kind":"capability-marker.txt","uri":"aiq-artifact://sha256/83741534dc3125175944ec8e34d515ff35682d83fba0a4cf40d32ccaaaacacf3/capability-marker.txt"}],"codex_version":"codex fixture","evidence_digest":"sha256:97f073b738481b94c5f52f6150548d8e186577977b9cbceb625e132ff62c1138","failure":null,"observed_at":"unix-ms:1","result_digest":"sha256:d589d72f939227c9ab28e3cbb50546a732fbcfe00269b193557c76ea05fdd18e","result_preview":"AIQ_PREFLIGHT_OK","status":"available"},"reason":"active probe succeeded","status":"available"},{"model":{"family":"terra","reasoning_effort":"max"},"probe":{"artifacts":[{"bytes":36,"content_hash":"sha256:83741534dc3125175944ec8e34d515ff35682d83fba0a4cf40d32ccaaaacacf3","kind":"capability-marker.txt","uri":"aiq-artifact://sha256/83741534dc3125175944ec8e34d515ff35682d83fba0a4cf40d32ccaaaacacf3/capability-marker.txt"}],"codex_version":"codex fixture","evidence_digest":"sha256:ee0db48137ff90e6739bcc64687da9780e4ed725d26f2c1537594a6c4bb49915","failure":null,"observed_at":"unix-ms:1","result_digest":"sha256:d589d72f939227c9ab28e3cbb50546a732fbcfe00269b193557c76ea05fdd18e","result_preview":"AIQ_PREFLIGHT_OK","status":"available"},"reason":"active probe succeeded","status":"available"},{"model":{"family":"terra","reasoning_effort":"ultra"},"probe":{"artifacts":[{"bytes":36,"content_hash":"sha256:83741534dc3125175944ec8e34d515ff35682d83fba0a4cf40d32ccaaaacacf3","kind":"capability-marker.txt","uri":"aiq-artifact://sha256/83741534dc3125175944ec8e34d515ff35682d83fba0a4cf40d32ccaaaacacf3/capability-marker.txt"}],"codex_version":"codex fixture","evidence_digest":"sha256:0c9b94df192e75ef28fdf0b192437aaf388bb26c82f9f8a5519f5750c68512fb","failure":null,"observed_at":"unix-ms:1","result_digest":"sha256:d589d72f939227c9ab28e3cbb50546a732fbcfe00269b193557c76ea05fdd18e","result_preview":"AIQ_PREFLIGHT_OK","status":"available"},"reason":"active probe succeeded","status":"available"},{"model":{"family":"luna","reasoning_effort":"low"},"probe":{"artifacts":[{"bytes":36,"content_hash":"sha256:83741534dc3125175944ec8e34d515ff35682d83fba0a4cf40d32ccaaaacacf3","kind":"capability-marker.txt","uri":"aiq-artifact://sha256/83741534dc3125175944ec8e34d515ff35682d83fba0a4cf40d32ccaaaacacf3/capability-marker.txt"}],"codex_version":"codex fixture","evidence_digest":"sha256:bd99c4e62d2cb0380cdc54f525645ce5c356ff04c912d5b8869ff2123dacebd2","failure":null,"observed_at":"unix-ms:1","result_digest":"sha256:d589d72f939227c9ab28e3cbb50546a732fbcfe00269b193557c76ea05fdd18e","result_preview":"AIQ_PREFLIGHT_OK","status":"available"},"reason":"active probe succeeded","status":"available"},{"model":{"family":"luna","reasoning_effort":"medium"},"probe":{"artifacts":[{"bytes":36,"content_hash":"sha256:83741534dc3125175944ec8e34d515ff35682d83fba0a4cf40d32ccaaaacacf3","kind":"capability-marker.txt","uri":"aiq-artifact: